{
  "schema_version": "1.1.0",
  "meta": {
    "source_file": "Aomori Plan DB - Sheet1.csv",
    "generated_on": "2026-10-23",
    "parse_notes": [
      "Flight times are stored as local wall-clock time per airport. The implied flight time is 5h15m outbound (23:45 BKK to 07:00 NRT) vs 7h15m return, so confirm whether the outbound arrival is in Tokyo time or Bangkok time.",
      "All prices are empty in the source and are stored as null. Flight currency is THB, plan currency is JPY.",
      "Thai-language notes were translated to English in 'note'; the original is kept in 'note_original'.",
      "Hotel check-in/check-out dates are derived from the 'Sleep City' column and the day dates.",
      "day_type, category and cuisine are derived labels added for the UI; they are not in the source.",
      "Drive durations are travel time between consecutive points only, as written in the source.",
      "Items marked needs_review had ambiguous or possibly mistyped source text."
    ]
  },
  "trip": {
    "id": "aomori-tohoku-2026",
    "title": "Aomori to Tokyo Road Trip",
    "region": "Tohoku, Japan",
    "start_date": "2026-10-28",
    "end_date": "2026-11-09",
    "day_count": 13,
    "night_count": 12,
    "default_currency": "JPY",
    "home_timezone": "Asia/Bangkok",
    "destination_timezone": "Asia/Tokyo"
  },
  "flights": [
    {
      "id": "fl-01",
      "direction": "outbound",
      "flight_number": "ZG052",
      "origin": {
        "iata": "BKK",
        "city": "Bangkok"
      },
      "destination": {
        "iata": "NRT",
        "city": "Tokyo (Narita)"
      },
      "departure": {
        "local_datetime": "2026-10-27T23:45",
        "timezone": "Asia/Bangkok"
      },
      "arrival": {
        "local_datetime": "2026-10-28T07:00",
        "timezone": "Asia/Tokyo"
      },
      "routing": "direct",
      "price": null,
      "currency": "THB",
      "needs_review": true,
      "review_note": "Source: '27 Oct 23:45 - 07:00 (+1)'. Arrival timezone assumed to be Tokyo; implied duration is 5h15m vs 7h15m on the return."
    },
    {
      "id": "fl-02",
      "direction": "return",
      "flight_number": "ZG051",
      "origin": {
        "iata": "NRT",
        "city": "Tokyo (Narita)"
      },
      "destination": {
        "iata": "BKK",
        "city": "Bangkok"
      },
      "departure": {
        "local_datetime": "2026-11-09T17:00",
        "timezone": "Asia/Tokyo"
      },
      "arrival": {
        "local_datetime": "2026-11-09T22:15",
        "timezone": "Asia/Bangkok"
      },
      "routing": "direct",
      "price": null,
      "currency": null
    }
  ],
  "accommodations": [
    {
      "id": "acc-01",
      "name": "Home in Aomori",
      "city": "Aomori",
      "type": "other",
      "check_in": "2026-10-28",
      "check_out": "2026-10-30",
      "nights": 2,
      "day_numbers": [
        1,
        2
      ],
      "meal_plan": null,
      "price": null,
      "currency": "JPY",
      "location": {
        "lat": 40.822734,
        "lng": 140.746924,
        "maps_query": "Home in Aomori, Aomori",
        "maps_link_disabled": true
      }
    },
    {
      "id": "acc-02",
      "name": "Kamenoi Hotel Akita Yuze",
      "city": "Akita Yuze",
      "type": "hotel",
      "check_in": "2026-10-30",
      "check_out": "2026-10-31",
      "nights": 1,
      "day_numbers": [
        3
      ],
      "meal_plan": "half_board",
      "price": null,
      "currency": "JPY",
      "location": {
        "lat": null,
        "lng": null,
        "maps_query": "Kamenoi Hotel Akita Yuze, Akita Yuze, Japan"
      }
    },
    {
      "id": "acc-03",
      "name": "Cerulean Resort Aoni",
      "city": "Nyuto Onsen",
      "type": "resort",
      "check_in": "2026-10-31",
      "check_out": "2026-11-01",
      "nights": 1,
      "day_numbers": [
        4
      ],
      "meal_plan": "half_board",
      "price": null,
      "currency": "JPY",
      "needs_review": true,
      "review_note": "Name kept exactly as written in the source ('Aoni'); verify the spelling.",
      "location": {
        "lat": null,
        "lng": null,
        "maps_query": "Cerulean Resort Aoni, Nyuto Onsen, Japan"
      }
    },
    {
      "id": "acc-04",
      "name": "Daiwa Roynet Morioka Ekimae",
      "city": "Morioka",
      "type": "hotel",
      "check_in": "2026-11-01",
      "check_out": "2026-11-03",
      "nights": 2,
      "day_numbers": [
        5,
        6
      ],
      "meal_plan": null,
      "price": null,
      "currency": "JPY",
      "location": {
        "lat": 39.701846,
        "lng": 141.138985,
        "maps_query": "Daiwa Roynet Morioka Ekimae, Morioka"
      }
    },
    {
      "id": "acc-05",
      "name": "Rakuten STAY x EAGLES 202 with Roof balcony",
      "city": "Sendai",
      "type": "apartment",
      "check_in": "2026-11-03",
      "check_out": "2026-11-05",
      "nights": 2,
      "day_numbers": [
        7,
        8
      ],
      "meal_plan": null,
      "price": null,
      "currency": "JPY",
      "location": {
        "lat": null,
        "lng": null,
        "maps_query": "Rakuten STAY x EAGLES 202 with Roof balcony, Sendai, Japan"
      }
    },
    {
      "id": "acc-06",
      "name": "Daiwa Roynet Koriyama",
      "city": "Koriyama",
      "type": "hotel",
      "check_in": "2026-11-05",
      "check_out": "2026-11-06",
      "nights": 1,
      "day_numbers": [
        9
      ],
      "meal_plan": null,
      "price": null,
      "currency": "JPY",
      "location": {
        "lat": 37.397552,
        "lng": 140.386891,
        "maps_query": "Daiwa Roynet Koriyama, Koriyama"
      }
    },
    {
      "id": "acc-07",
      "name": "MIMARU Tokyo Shinjuku West",
      "city": "Tokyo",
      "type": "apartment",
      "check_in": "2026-11-06",
      "check_out": "2026-11-09",
      "nights": 3,
      "day_numbers": [
        10,
        11,
        12
      ],
      "meal_plan": null,
      "price": null,
      "currency": "JPY",
      "location": {
        "lat": null,
        "lng": null,
        "maps_query": "MIMARU Tokyo Shinjuku West, Tokyo, Japan"
      }
    }
  ],
  "rentals": [
    {
      "id": "rent-01",
      "type": "car",
      "pickup": {
        "location": null,
        "date": null
      },
      "return": {
        "location": "Koriyama",
        "date": "2026-11-06",
        "time": "11:00",
        "approximate": true
      },
      "notes": "Pick-up is not specified in the source. Drive legs first appear on Day 2 (Oct 29) and the last drive is Day 9 (Nov 5)."
    }
  ],
  "days": [
    {
      "id": "day-01",
      "day_number": 1,
      "date": "2026-10-28",
      "weekday": "Wednesday",
      "day_type": "arrival",
      "travel_city": "Aomori",
      "sleep_city": "Aomori",
      "accommodation_id": "acc-01",
      "flight_ids": [
        "fl-01"
      ],
      "transport": [
        {
          "id": "d01-t01",
          "order": 1,
          "mode": "train",
          "from": "Narita Airport",
          "to": "Tokyo",
          "duration_minutes": null,
          "note": "Narita Express (N'EX)"
        },
        {
          "id": "d01-t02",
          "order": 2,
          "mode": "shinkansen",
          "from": "Tokyo",
          "to": "Shin-Aomori",
          "duration_minutes": 191,
          "note": "3 hr 11 min"
        }
      ],
      "sightseeing": [
        {
          "id": "d01-s01",
          "order": 1,
          "name": "Nebuta Museum WA RASSE",
          "category": "museum",
          "note": null,
          "location": {
            "lat": 40.829572,
            "lng": 140.735946,
            "maps_query": "Nebuta Museum WA RASSE, Aomori, Japan"
          }
        },
        {
          "id": "d01-s02",
          "order": 2,
          "name": "A-Factory",
          "category": "shopping",
          "note": "Apple pie",
          "location": {
            "lat": 40.830221,
            "lng": 140.735161,
            "maps_query": "A-Factory, Aomori, Japan"
          }
        },
        {
          "id": "d01-s03",
          "order": 3,
          "name": "Toys R Us at Ciina Ciina mall",
          "category": "shopping",
          "note": null,
          "location": null
        },
        {
          "id": "d01-s04",
          "order": 4,
          "name": "Aomori Bay",
          "category": "nature",
          "note": "Anri bakery",
          "location": null
        },
        {
          "id": "d01-s05",
          "order": 5,
          "name": "Aomori Bank Memorial Museum",
          "category": "museum",
          "note": null,
          "location": {
            "lat": 40.602916,
            "lng": 140.468564,
            "maps_query": "Aomori Bank Memorial Museum, Aomori, Japan"
          }
        }
      ],
      "food": [
        {
          "id": "d01-f01",
          "order": 1,
          "name": "Osanai",
          "meal": "unspecified",
          "cuisine": null,
          "note": null,
          "location": {
            "lat": 40.828052,
            "lng": 140.736006,
            "maps_query": "Osanai, Aomori, Japan"
          }
        }
      ],
      "todos": [],
      "notes": [],
      "source_text": {
        "travel": "Nex Narita to Tokyo Shinkanzen to Shin-Aomori (3hr 11min",
        "sightseeing": "Nebuta Museum WA RASSE, A Factory (Apple Pie), ToyRus at Ciina Ciina mall, Aomori bay (Anri bakery), Aomori Bank memorial museum )",
        "food": "Osanai",
        "hotel": "Home in Aomori"
      },
      "location": {
        "lat": 40.822734,
        "lng": 140.746924,
        "maps_query": "Aomori city, Aomori Prefecture"
      }
    },
    {
      "id": "day-02",
      "day_number": 2,
      "date": "2026-10-29",
      "weekday": "Thursday",
      "day_type": "sightseeing",
      "travel_city": "Hirosaki",
      "sleep_city": "Aomori",
      "accommodation_id": "acc-01",
      "flight_ids": [],
      "transport": [
        {
          "id": "d02-t01",
          "order": 1,